{
  "apiVersion": "hosting.lowerduckpond.net/v1alpha1",
  "kind": "DeploymentRecord",
  "id": "0191e2ca-49f2-7608-8cf3-f80ab2cab151",
  "tenantId": "0191e2c4-8f7a-7c3b-8d1e-5f62047a2100",
  "archiveSha256": "0123456789abcdef0123456789abcdef0123456789abcdef0123456789abcdef",
  "releaseTreeDigest": {
    "format": "lowerduckpond-release-tree-v1",
    "algorithm": "sha256",
    "value": "cccccccccccccccccccccccccccccccccccccccccccccccccccccccccccccccc"
  },
  "createdAt": "2026-08-29T12:00:30Z",
  "correlationId": "0198d17f-6f4a-7000-8000-000000000001"
}
